{"$id":"https://six-birds.local/fvii-sci-01/countermodel.schema.json","$schema":"https://json-schema.org/draft/2020-12/schema","additionalProperties":false,"properties":{"candidate_ids":{"items":{"pattern":"^VII-C[0-9]{3}$","type":"string"},"type":"array","uniqueItems":true},"escape_route":{"minLength":1,"type":"string"},"expected_status":{"enum":["BOOTSTRAP_BLOCKED","BUDGET_OBSTRUCTION","CERTIFIED_NONINTERACTION","COMMON_REFINEMENT_NONSTRICT","CONTACT_WITHOUT_JOIN","DRIVEN_ARROW","FAKE_JOIN_RELABELING","FAKE_JOIN_SCHEDULING","HOLONOMY_ZERO_ARROW","INDEPENDENCE_GATE_FAILED","LAWFUL_FIRST_EXTENSION","NO_EVIDENCED_CONTACT","OCCURRENT_EVENT","ORDER_RESIDUE","PROSPECTIVE_ADMISSION","REACHABLE_NONOCCURRENT","REFINEMENT_DESTROYS_JOIN","RETENTION_OBSTRUCTION","RETROSPECTIVE_SELF_CERTIFICATION_REJECTED","SOUND_UNREACHABLE","SOURCE_OBSTRUCTION","STRICT_JOIN","UNLICENSED_TOTALITY_TRANSFER","UNPRICED_OBSERVER"],"type":"string"},"fixture_id":{"pattern":"^CM-[0-9]{2}$","type":"string"},"fixture_kind":{"const":"countermodel"},"name":{"minLength":1,"type":"string"},"scenario_id":{"pattern":"^TTW-S[0-9]{2}$","type":"string"},"scenario_sha256":{"pattern":"^[0-9a-f]{64}$","type":"string"},"schema_version":{"const":"FVII-SCI-01.3"},"shows":{"minLength":1,"type":"string"},"source_trace":{"additionalProperties":false,"properties":{"evidence_grade":{"minLength":1,"type":"string"},"scenario_source_id":{"minLength":1,"type":"string"},"source_id":{"minLength":1,"type":"string"},"source_path":{"minLength":1,"type":"string"}},"required":["source_path","source_id","scenario_source_id","evidence_grade"],"type":"object"}},"required":["schema_version","fixture_kind","fixture_id","name","scenario_id","expected_status","shows","candidate_ids","escape_route","scenario_sha256","source_trace"],"title":"Foundations VII Phase-1 countermodel fixture","type":"object"}
