{"candidate_ids":["VII-C009"],"escape_route":"Add the missing typed witness or narrow the claim; do not relabel the countermodel as a positive case.","expected_status":"FAKE_JOIN_RELABELING","fixture_id":"CM-15","fixture_kind":"countermodel","name":"Strict extension without certified objecthood","scenario_id":"TTW-S15","scenario_sha256":"5d3afb3d50f282a194010c5c8fb872cc68fd7aad8d877f8ad87c78463f272faf","schema_version":"FVII-SCI-01.3","shows":"Nonfactorization does not imply closure/objecthood.","source_trace":{"evidence_grade":"FINITE_COUNTERMODEL_FIXTURE_NOT_UNIVERSAL_THEOREM","scenario_source_id":"TTW-S15","source_id":"CM-15","source_path":"readiness/countermodel_atlas.jsonl"}}
