{"candidate_ids":["VII-C009","VII-C032"],"escape_route":"Add the missing typed witness or narrow the claim; do not relabel the countermodel as a positive case.","expected_status":"STRICT_JOIN","fixture_id":"CM-16","fixture_kind":"countermodel","name":"Strict join without directionality","scenario_id":"TTW-S08","scenario_sha256":"10a6f2a7c8d439222702a8dd21a9406d8d8f29eb371e5984e06ed8139cc588eb","schema_version":"FVII-SCI-01.3","shows":"Strict novelty does not imply a P6 arrow.","source_trace":{"evidence_grade":"FINITE_COUNTERMODEL_FIXTURE_NOT_UNIVERSAL_THEOREM","scenario_source_id":"TTW-S08","source_id":"CM-16","source_path":"readiness/countermodel_atlas.jsonl"}}
