{"candidate_ids":["VII-C011","VII-C029","VII-C031","VII-C035"],"escape_route":"Add the missing typed witness or narrow the claim; do not relabel the countermodel as a positive case.","expected_status":"UNPRICED_OBSERVER","fixture_id":"CM-21","fixture_kind":"countermodel","name":"Zero-cost join hides positive observer cost","scenario_id":"TTW-S22","scenario_sha256":"114cdd06ad3768679e90f0c208a1e9749236c5e2660cb8e8d7d002f3823b6dba","schema_version":"FVII-SCI-01.3","shows":"Unpriced occupancy invalidates no-cost credit.","source_trace":{"evidence_grade":"FINITE_COUNTERMODEL_FIXTURE_NOT_UNIVERSAL_THEOREM","scenario_source_id":"TTW-S22","source_id":"CM-21","source_path":"readiness/countermodel_atlas.jsonl"}}
