{"candidate_ids":["VII-C001","VII-C002","VII-C021"],"escape_route":"Add the missing typed witness or narrow the claim; do not relabel the countermodel as a positive case.","expected_status":"SOUND_UNREACHABLE","fixture_id":"CM-08","fixture_kind":"countermodel","name":"Sound but unreachable admission rule","scenario_id":"TTW-S19","scenario_sha256":"008f8f3234d18bf071bbc2952c50b4f219f866d6a3cdfc91078c54d62ba3eb4e","schema_version":"FVII-SCI-01.3","shows":"Soundness does not imply operational reachability.","source_trace":{"evidence_grade":"FINITE_COUNTERMODEL_FIXTURE_NOT_UNIVERSAL_THEOREM","scenario_source_id":"TTW-S19","source_id":"CM-08","source_path":"readiness/countermodel_atlas.jsonl"}}
