{"candidate_ids":["VII-C008","VII-C009","VII-C026"],"escape_route":"Add the missing typed witness or narrow the claim; do not relabel the countermodel as a positive case.","expected_status":"COMMON_REFINEMENT_NONSTRICT","fixture_id":"CM-13","fixture_kind":"countermodel","name":"Product/common refinement without strictness","scenario_id":"TTW-S07","scenario_sha256":"a977ea23844e34b6cc0e2a78d68a997097f46ccfd84ab2c2aeef639931c33667","schema_version":"FVII-SCI-01.3","shows":"Common refinement is not anti-product novelty.","source_trace":{"evidence_grade":"FINITE_COUNTERMODEL_FIXTURE_NOT_UNIVERSAL_THEOREM","scenario_source_id":"TTW-S07","source_id":"CM-13","source_path":"readiness/countermodel_atlas.jsonl"}}
