{"candidate_ids":["VII-C005","VII-C010"],"escape_route":"Add the missing typed witness or narrow the claim; do not relabel the countermodel as a positive case.","expected_status":"INDEPENDENCE_GATE_FAILED","fixture_id":"CM-01","fixture_kind":"countermodel","name":"Same source but no shared access","scenario_id":"TTW-S05","scenario_sha256":"32e058129248a86fcd74df5d9e04b21892fd754dff6000738ca5c1fccd17980c","schema_version":"FVII-SCI-01.3","shows":"Common origin does not imply shared access or independence.","source_trace":{"evidence_grade":"FINITE_COUNTERMODEL_FIXTURE_NOT_UNIVERSAL_THEOREM","scenario_source_id":"TTW-S05","source_id":"CM-01","source_path":"readiness/countermodel_atlas.jsonl"}}
