{"candidate_ids":["VII-C012","VII-C013","VII-C014"],"escape_route":"Add the missing typed witness or narrow the claim; do not relabel the countermodel as a positive case.","expected_status":"LAWFUL_FIRST_EXTENSION","fixture_id":"CM-17","fixture_kind":"countermodel","name":"Theorist-triggered enablement is not endogenous","scenario_id":"TTW-S02","scenario_sha256":"04499c6abe9f0d8bd1c98e9e0ae14f8af40a57016b269906acaff20e75926c04","schema_version":"FVII-SCI-01.3","shows":"Execution by the analyst fails the carried-generator condition.","source_trace":{"evidence_grade":"FINITE_COUNTERMODEL_FIXTURE_NOT_UNIVERSAL_THEOREM","scenario_source_id":"TTW-S02","source_id":"CM-17","source_path":"readiness/countermodel_atlas.jsonl"}}
