{"candidate_ids":["VII-C009","VII-C030"],"escape_route":"Add the missing typed witness or narrow the claim; do not relabel the countermodel as a positive case.","expected_status":"RETENTION_OBSTRUCTION","fixture_id":"CM-05","fixture_kind":"countermodel","name":"Join that loses one child","scenario_id":"TTW-S09","scenario_sha256":"302caadf2320d8fbd4b9908626fbce285fc4668bb2e310dd95b7a1dd27648395","schema_version":"FVII-SCI-01.3","shows":"Composite formation does not imply parent retention.","source_trace":{"evidence_grade":"FINITE_COUNTERMODEL_FIXTURE_NOT_UNIVERSAL_THEOREM","scenario_source_id":"TTW-S09","source_id":"CM-05","source_path":"readiness/countermodel_atlas.jsonl"}}
