{"candidate_ids":["VII-C008","VII-C026","VII-C033"],"escape_route":"Add the missing typed witness or narrow the claim; do not relabel the countermodel as a positive case.","expected_status":"CERTIFIED_NONINTERACTION","fixture_id":"CM-27","fixture_kind":"countermodel","name":"Lawful parents with no common admissible package","scenario_id":"TTW-S13","scenario_sha256":"f6c334bb37d6e708a76e40c953340380845f465fba974ed2a1962f5a575f79a1","schema_version":"FVII-SCI-01.3","shows":"Parent lawfulness does not guarantee join existence.","source_trace":{"evidence_grade":"FINITE_COUNTERMODEL_FIXTURE_NOT_UNIVERSAL_THEOREM","scenario_source_id":"TTW-S13","source_id":"CM-27","source_path":"readiness/countermodel_atlas.jsonl"}}
