{"candidate_ids":["VII-C003","VII-C016","VII-C035"],"escape_route":"Add the missing typed witness or narrow the claim; do not relabel the countermodel as a positive case.","expected_status":"BOOTSTRAP_BLOCKED","fixture_id":"CM-19","fixture_kind":"countermodel","name":"Shared carrier without lawful peer transport","scenario_id":"TTW-S01","scenario_sha256":"fac266fdc751e851da83c4f857a87581eb334ce0b56a46d3d59ee7b90378ccb8","schema_version":"FVII-SCI-01.3","shows":"Co-location does not provide an executable bridge or first capability.","source_trace":{"evidence_grade":"FINITE_COUNTERMODEL_FIXTURE_NOT_UNIVERSAL_THEOREM","scenario_source_id":"TTW-S01","source_id":"CM-19","source_path":"readiness/countermodel_atlas.jsonl"}}
