{"candidate_ids":["VII-C012","VII-C015","VII-C034"],"escape_route":"Add the missing typed witness or narrow the claim; do not relabel the countermodel as a positive case.","expected_status":"PROSPECTIVE_ADMISSION","fixture_id":"CM-06","fixture_kind":"countermodel","name":"Enablement without descent","scenario_id":"TTW-S03","scenario_sha256":"006a5078798f5f0101903b2ac6a66bbe97073db9ea602de64176d97e0cedcc32","schema_version":"FVII-SCI-01.3","shows":"An enabling condition can be load-bearing without factorization of the enabled object.","source_trace":{"evidence_grade":"FINITE_COUNTERMODEL_FIXTURE_NOT_UNIVERSAL_THEOREM","scenario_source_id":"TTW-S03","source_id":"CM-06","source_path":"readiness/countermodel_atlas.jsonl"}}
