{"candidate_ids":["VII-C003","VII-C004","VII-C006"],"escape_route":"Add the missing typed witness or narrow the claim; do not relabel the countermodel as a positive case.","expected_status":"RETROSPECTIVE_SELF_CERTIFICATION_REJECTED","fixture_id":"CM-20","fixture_kind":"countermodel","name":"Post-hoc prediction self-certification","scenario_id":"TTW-S04","scenario_sha256":"672fc0177baee77b11489833106dec5b5686b3c5b0ee826b667ef9e1b25402fa","schema_version":"FVII-SCI-01.3","shows":"Retrospective admission cannot earn prospective credit.","source_trace":{"evidence_grade":"FINITE_COUNTERMODEL_FIXTURE_NOT_UNIVERSAL_THEOREM","scenario_source_id":"TTW-S04","source_id":"CM-20","source_path":"readiness/countermodel_atlas.jsonl"}}
