{"candidate_ids":["VII-C007","VII-C009","VII-C036"],"escape_route":"Add the missing typed witness or narrow the claim; do not relabel the countermodel as a positive case.","expected_status":"CONTACT_WITHOUT_JOIN","fixture_id":"CM-03","fixture_kind":"countermodel","name":"Contact without strict joint information","scenario_id":"TTW-S06","scenario_sha256":"a1e3347848d419f0f27d88cc8f858569c18938bc3fccdc95bc544f52dbeddf8f","schema_version":"FVII-SCI-01.3","shows":"Contact does not imply strict join.","source_trace":{"evidence_grade":"FINITE_COUNTERMODEL_FIXTURE_NOT_UNIVERSAL_THEOREM","scenario_source_id":"TTW-S06","source_id":"CM-03","source_path":"readiness/countermodel_atlas.jsonl"}}
